,URL,title,subtitle,content,article time
10,https://www.moneycontrol.com/news/business/markets/spicejet-says-eyeing-growth-with-aircraft-ungrounding-fleet-expansion-exclusive-destinations-12816162.html,"SpiceJet says eyeing growth with aircraft ungrounding, fleet expansion, exclusive destinations","SpiceJet is struggling with heavy financial dues and grounded aircraft, which has slowed down its operations to a snail's pace..Related stories.","Embattled airline operatorSpiceJetsaid on 6 September that it expects a 'promising growth' for its operations, helped by a likely ungrounding of aircraft, impending expansion of the aircraft fleet, exclusive access to regional destinations, and also access to international destinations. The carrier is struggling with heavy financial dues and grounded aircraft, which has slowed down its operations to a snail's pace. However, going ahead, SpiceJet expects 28 of its aircraft to be ungrounded, doubling its operational fleet capacity. SpiceJet's operational fleet has been reduced from 74 aircraft in 2019 to 28 in 2024, with 36 aircraft grounded on account of dues and fund issues, the company said in an investor presentation. The airline was hit by a worldwide grounding of Boeing 737 Max aircraft in March 2019. Further, it also faced another grounding of aircraft due to inability to make lease payments, it said in the presentation. In other woes, a substantial rise in crude oil prices also hit the airline with higher fuel costs. ""Brent crude oil reached ~$ 120 per barrel, while ATF price went up to ~ $175 per barrel, breaching the all-time high in June 2022,"" said the presentation. In the dues to be paid, SpiceJet owes about Rs 3,700 crore in outstanding lessor, engineering & EDC liabilities, which led to grounding of aircraft. It has about Rs 650 crore outstanding statutory dues. SpiceJet share price has moved higher by 1.35 percent on Year-to-date rate.Â In the last one year, the shares have delivered 54.81 percent returns. ","September 06, 2024/ 18:47 IST"
11,https://www.moneycontrol.com/news/business/markets/taking-stock-bears-tighten-control-nifty-below-24900-sensex-falls-1017-pts-12816196.html,"Taking Stock: Bears tighten control; Nifty below 24,900, Sensex falls 1,017 pts",Market Today.Related stories.,"Indian markets ended lower for the third consecutive session on September 6, with Nifty falling nearÂ 24,800Â while the Sensex broke 81,000-mark ahead of the US jobs data, set to be released later today. At close, the Sensex was down 1,017.23 points or 1.24 percent at 81,183.93, and the Nifty was down 292.95 points or 1.17 percent at 24,852.15. For the week, BSE Sensex and Nifty50 indices shed 1.5 percent each. Biggest Nifty losers included SBI, HCL Technologies, NTPC, ICICI Bank and BPCL, while gainers were Asian Paints, JSW Steel, Bajaj Finance, LTIMindtree and Divis Labs. All the sectoral indices ended in the red with auto, PSU Bank, oil & gas, media, telecom, IT, realty, capital goods down 1-3 percent. The BSE midcap index shed 1.4 percent, while the smallcap index declined 1 percent after hitting a fresh record high. In today's fall, investors' wealth eroded by around Rs 5.31 lakh crore, as the market capitalization of BSE-listed companies slipped to Rs 460.40 lakh crore, from Rs 465.68 lakh crore in the previous session. Nearly 290 stocks touched their 52-high on the BSE, including, Ajanta Pharma, Akzo Nobel, Colgate Palmolive, Emami, Gillette India, Godfrey Phillips, Godrej Industries, Jubilant Pharmova, Maharashtra Scooters, Muthoot Finance, NESCO, Persistent Systems, PI Industries, Piramal Pharma, Suven Pharma, VST Industries, among others.Click to view full list Outlook for September 9 Jatin Gedia â€“ Technical Research Analyst at Sharekhan by BNP Paribas Nifty opened on a flat note and witnessed a sharp decline. It closed in the red down ~280 points. On the daily charts we can observe that the Nifty on account of the fall has reached the crucial support zone 24850 â€“ 24800 which coincides with the 20-day moving average and the 38.2% Fibonacci retracement level. We expect the Nifty to hold on to this support zone and hence shall continue to maintain our short-term positive stance on the Nifty. The immediate hurdle is placed at 25000. The Banking sector led the fall in todayâ€™s trading session. It has decisively closed below the short-term averages and the daily momentum indicator has a negative crossover which is a sell signal. Thus, pullback is likely to get sold into. In terms of levels, 50800 â€“ 50949 shall act as an immediate hurdle zone while 50000 â€“ 49700 is the crucial support zone from short term perspective. Ajit Mishra â€“ SVP, Research, Religare Broking On Friday, markets came under pressure and closed over a percent lower, weighed down by weak global cues. After a flat start, the Nifty gradually declined throughout the day, breaking multiple support levels to end at 24,852.15. The sell-off was broad-based, with the banking and energy sectors taking the biggest hit. Broader indices also saw declines, losing more than a percent each. The recent weakness in US markets has stalled the momentum in Indian markets, causing participants to become cautious ahead of the upcoming jobs data. With the Nifty slipping below the crucial 20-day exponential moving average (DEMA), further downside is likely, with key support around 24,500 at the 50 DEMA. Given the circumstances, it is advisable to avoid taking aggressive positions and to apply strict stop losses on existing trades. ","September 06, 2024/ 16:09 IST"
12,https://www.moneycontrol.com/news/business/stocks/diis-net-buy-shares-worth-rs-2121-crore-today-fiis-sell-rs-620-crore-12816460.html,"DIIs net buy shares worth Rs 2,121 crore today, FIIs sell Rs 620 crore",representative image.,"On September 6, Domestic Institutional Investors (DIIs) net bought shares worth RsÂ 2,121.53 crore, while Foreign Institutional Investors (FIIs) net sold shares worth RsÂ 620.95 crore. DIIs bought shares worth RsÂ 15,699.2 crore and sold shares worth RsÂ 13,577.67 crore. On the other hand, FIIs bought shares worth RsÂ 16,911.35 crore and sold shares worth RsÂ 17,532.3 crore. ""The Nifty started the week on a positive note, but global uncertainty dampened market sentiment, leading the index to close the week negatively at 24,852. The volatility index, INDIA VIX, surged by 12.97% on a weekly basis, settling at 15.13, signaling a rise in market volatility,"" saidÂ Hrishikesh Yedve, AVP Technical and Derivatives Research at Asit C. Mehta Investment Interrmediates. In the year so far, FIIs have net sold shares worth RsÂ  1.38 lakh crore, while DIIs have bought shares worth Rs 3.16 lakh crore. ","September 06, 2024/ 22:42 IST"
13,https://www.moneycontrol.com/news/india/congress-accuses-sebi-chief-buch-of-getting-rental-income-from-firm-linked-to-wockhardt-alleges-corruption-12816152.html,"Congress accuses Sebi chief Buch of getting rental income from firm linked to Wockhardt, alleges corruption",SEBI Chairperson Madhabi Puri Buch.Related stories.,"In a fresh set of allegations, Congress accused the Securities and Exchange Board of India (Sebi) chief Madhabi Puri Buch for an ""out and out corruption"" after theÂ main Opposition party revealed that the market regulator was involved in several cases, including charges of insider trading, against two companies linked to the market regulator chairperson. Congress spokesperson Pawan Khera alleged that Buch rented out her properties to Carol Info Services, which is part of Wockhardt, against whom the market regulator is investigating several cases including that of insider trading. ""Madhabi Puri Buch ji had become the whole-time member of Sebi in 2018. Now after becoming a whole-time member, she rented out one of his properties. In the financial year 2018-19, she received a rent of Rs 7 lakh on it. SheÂ received rent of Rs 36 lakh for the same property in 2019-20, which increased to Rs 46 lakh this year. The name of the company to which Madhabi Puri Buch gave her property is Carol Info Services Limited, which is a part of Wockhardt company,"" Khera said.2018 SEBI Whole Time Member Whole Time Member 2018-19 7 2019-20 36 ,pic.twitter.com/U4BjMORweVCongress (@INCIndia)September 6, 2024 He further added, ""Wockhardt is the same company whose complaints are being continuously dealt with by Sebi. This is completely a case of corruption."" Khera alleged that Buch, after assuming the role of whole-time director, rented out her home to a company from which she received Rs 2.16 crore as rent. ""So we want to know where did you give this information? Is it right that you rent your property to a company whose cases you are handling? Is this ethically and legally correct?"" Khera said the issues related to the Sebi chairperson is very serious and the party is receiving new information every day. Read more:ÂWockhardt stock falls 5% as Congress accuses SEBI chief Buch of corruption ""Crores of people of the country trust Sebi. If a question mark is raised on this, then the investment of the public will be put into question. At the same time, the Prime Minister of this country is not worried about the country's reputation - this is our biggest concern."" The Congress leader also attacked PM Modi and asked if there was any agreement that the government won't interfere in companies linked to Sebi chief.Â ""What boon did Prime Minister Narendra Modi give to Madhavi Buch ji that whatever she does is forgiven?,"" he asked. Moneycontrol has reached out to Sebi for a comment and this story will be updated once they respond. ","September 06, 2024/ 16:16 IST"
14,https://www.moneycontrol.com/news/business/markets/sanlam-eyes-india-wealth-management-foray-with-shriram-capital-group-12816383.html,Sanlam eyes India wealth management foray with Shriram Capital Group,Sanlam plans to build its partnership with Shriram Capital Group in India by adding an equal JV covering wealth and advice services..,"Sanlam Ltd. is joining the race to enter IndiaŌĆÖs burgeoning asset- and wealth-management industry as AfricaŌĆÖs biggest insurer by market value seeks to tap opportunities in the worldŌĆÖs fastest-growing major economy. The insurer plans to build out its partnership with Shriram Capital Group in the South Asian nation by adding an equal joint venture covering wealth and advice services, doubling down on an initial 2005 investment that has already delivered results in the credit and insurance spaces. ŌĆ£A large number of people are breaking out of the real poverty trap, so theyŌĆÖre able to start focusing on providing for the future,ŌĆØ Sanlam Chief Executive Officer Paul Hanratty said in an interview Thursday. ŌĆ£India is really at that point where a huge chunk of the population are now able to save and invest for the future.ŌĆØ The International Monetary Fund expects IndiaŌĆÖs $3.9 trillion economy to expand 6.8% this year. That compares with a forecast for 0.9% growth for South Africa, SanlamŌĆÖs home market. The South Asian nation is expected to generate $730 billion of wealth through 2028, according to┬ĀBoston Consulting Group, and thatŌĆÖs enticing firms including HSBC Holdings Plc and Barclays Plc to expand. State Bank of India, which has more than 22,500 branches in the country, is deploying 2,000 bankers to┬Āwoo the rich. Blackrock Inc., the worldŌĆÖs biggest fund manager, in April signed an equal joint venture with billionaire Mukesh AmbaniŌĆÖs Jio Financial Services Ltd. to set up a wealth-management business and also form a brokerage company in India. The two entities formed a joint venture to set up an Indian asset-management business in July 2023. ŌĆ£ThatŌĆÖs a very hot area in India ŌĆö everybodyŌĆÖs trying to get into it and we are very well positioned to start up,ŌĆØ Hanratty said. ŌĆ£WeŌĆÖve got a huge distribution footprint, so weŌĆÖve just got to get the business and the proposition right, and then just gradually start growing it into our existing basis of branches and customers.ŌĆØ For the six months ended June 30, SanlamŌĆÖs India business generated about 16% of profit, up from 10% in 2021. The insurer said headline earnings climbed 43% in the period from a year earlier, buoyed by gains in life and health insurance, a surge in general insurance, and a recovery in investment management. The so-called net result from financial services ŌĆö the companyŌĆÖs preferred profit measure ŌĆö rose 19% per share. ŌĆ£The operating environment has been a little bit better in the first half of 2024,ŌĆØ Hanratty said, citing the successful conclusion of South AfricaŌĆÖs elections in May, where the inability to produce an outright winner saw the African National Congress ŌĆö which has ruled the country since 1994 ŌĆö establish a multiparty government with nine other entities. A┬Āturnaround┬Āat general-insurance unit Santam Ltd., and a strong performance in its African operations that include a joint venture with GermanyŌĆÖs Allianz SE, also boosted earnings.ŌĆØ Sanlam took a 910 million-rand impairment on AfroCentric Investment Corp., a South African health-administration company in which it holds a majority stake. ","September 06, 2024/ 18:37 IST"
15,https://www.moneycontrol.com/news/business/markets/dnp-moneycontrol-pro-weekender-12816357.html,Moneycontrol Pro Weekender: Fairy Tale Economics,"Treasuries rallied across the curve, with two-year yields down 11 basis points to 3.64%..Related stories.","Dear Reader, The September issue of the IMFŌĆÖs Finance and Development magazine has an article titled, intriguingly, ŌĆśFairy DustŌĆÖs Economic PossibilitiesŌĆÖ┬Āby Zachary Carter, a scholar with the Carnegie Endowment for International Peace. The reference to fairies comes from Lord KeynesŌĆÖ speech at the inaugural meeting of the World Bank and IMF, at Savannah in the US, in March 1946. Keynes, fresh from a performance of TchaikovskyŌĆÖs ballet ŌĆśSleeping BeautyŌĆÖ, said he hoped the Bretton Woods twins, Master Fund and Miss Bank, would receive three gifts from their fairy godmothers: first, a many-coloured coat ŌĆ£as a perpetual reminder that they belong to the whole worldŌĆØ; second, vitamins for ŌĆ£energy and a fearless spirit, which does not shelve and avoid difficult issues, but welcomes them and is determined to solve themŌĆØ; third, ŌĆ£a spirit of wisdomŌĆ” so that their approach to every problem is absolutely objectiveŌĆØ. Carter writes that Keynes celebrated the co-operation among nations at Bretton Woods as a ŌĆśŌĆÖvictory for the human spiritŌĆÖŌĆÖ. He quotes Keynes, who told the conference that, ŌĆ£We have been learning to work together. ŌĆ”If we can so continue, this nightmare, in which most of us here present have spent too much of our lives, will be over. The brotherhood of man will have become more than a phrase.ŌĆØ After the horrors of the Second World War, a longing for the brotherhood of man was inevitable. But the Soviet Union did not sign the Bretton Woods agreement and within a few years, the Korean War had broken out, putting an end to such fond hopes. To be honest, though, Keynes also┬Āwarned the delegates that ŌĆ£there is scarcely any enduringly successful experience yet of an international body which has fulfilled the hopes of its progenitorsŌĆØ. And he went on to say, again referring to the Sleeping Beauty tale, that he hoped ŌĆ£there is no malicious fairy, no Carabosse, whom he has overlooked and forgotten to ask to the party. For if so the curses which that bad fairy will pronounce will, I feel sure, run as follows: ŌĆ£You two brats shall grow up politicians; your every thought and act should have anarri├©re-pens├®e; everything you determine shall not be for its own sake or on its own merits but because of something else.ŌĆÖŌĆÖ Keynes had tasted defeat at the Bretton Woods conference, where all his proposals were shot down by the Americans, who were intent on ensuring US hegemony through the almighty dollar. Indeed, Robert Skidelsky, in his book on Keynes, wrote, ŌĆ£Frederic Vinson, the US Secretary of the Treasury, took it personally. ŌĆśI donŌĆÖt mind being called malicious, but I do mind being called a fairy,ŌĆÖ he growled.ŌĆØ Why bring up Bretton Woods now? The answer perhaps lies inanother article┬Āin this monthŌĆÖs ŌĆśFinance & DevelopmentŌĆÖ magazine, by former British prime minister Gordon Brown. He writes, ŌĆ£Global challenges that require global solutions are ever present, whether a changing climate or rising cyber threats. And just as we are facing these challenges, the three pillars of the postŌĆōCold War era anchoring the global systemŌĆöunipolarity, hyperglobalisation, and neoliberal economicsŌĆöare collapsing around us. These seismic shifts are sowing the seeds of a new wave of populist nationalism exemplified by the ŌĆ£America FirstŌĆØ, ŌĆ£Russia FirstŌĆØ, ŌĆ£India FirstŌĆØ, ŌĆ£China FirstŌĆØ, and often ŌĆ£my country first and onlyŌĆØ movements springing up round the world.ŌĆÖŌĆÖ We have moved a long way from the spirit of the Bretton Woods conference and are back to the beggar-thy-neighbour protectionist policies of the period between the World Wars. But many would question the assumption that the Bretton Woods institutions were anything other than an extension of US power. The IMFŌĆÖs forcing of austerity down the throats of nations in trouble has come in for much criticism. Indeed, as Carter writes, ŌĆ£KeynesŌĆÖs greatest fear for the Fund and the BankŌĆ” was that the ŌĆ£twinsŌĆØ would become instruments of US power rather than truly independent international bodiesŌĆÖŌĆÖ. As US economist Benn Steil shows in his book, ŌĆśThe Battle of Bretton WoodsŌĆÖ, far from being an embodiment of the human spirit, the Bretton Woods conference was full of intrigue, acrimony and rivalry, and it contains a wealth of anecdotes and quotes, some of which have been reproducedhere. For example, Keynes had remarked to British economist Richard Kahn at the Savannah meeting: ŌĆ£The Americans have no idea how to make these institutions into operating international concerns,ŌĆ” ┬Āand in almost every direction their ideas are bad. Yet. they plainly intend to force their own conceptions on the rest of us. The result is that the institutions look like becoming American concerns, run by gigantic American staffs, with the rest of us very much on the side-lines.ŌĆØ In a lecture delivered at the London School of Economics, Paul Bareau, a member of the British Treasury delegation to Washington, asserted that Keynes said, ŌĆ£I went to Savannah to meet the world, and all I met was a tyrant.ŌĆØ And in a letter to the Foreign Office, Keynes said they had to sign the Bretton Woods agreement without reading it because their hosts had made arrangements to throw them out of the hotel. Brotherhood of man, indeed! Keynes also detested Harry Dexter White, the leader of the US team at Bretton Woods and most of the other Americans there. Perhaps most scathing was this remark about Mariner Eccles, the Fed chairman: ŌĆ£No wonder that man is a Mormon. No single woman could stand him.ŌĆØ Nope, Bretton Woods was not about idealism or the spirit of brotherhood. The twin institutions were to be the instruments of US power and the US view was bulldozed through. Paul Bareau said, ŌĆ£We [the British] lost on every issue, not by the process of rational argument in debate but by the solid massing of the cohorts which voted automatically with America, [particularly the Latin Americans,] whose representatives could be depended on to read sometimes with considerable difficulty the speeches prepared for them by the Secretariat of the United States delegation.ŌĆØ The simple fact is that in Bretton Woods, the US prepared the ground to take over BritainŌĆÖs role as the worldŌĆÖs greatest power. US historian John Morton Blum wrote: ŌĆ£Congress was spontaneously more generous towards China than towards England, perhaps because no one envisaged China as a postwar rival for power or commerce.ŌĆØ The wheel has turned full circle and China is now AmericaŌĆÖs bete noire, just as Japan had become in the eighties. Keynes died within a month of the Savannah meeting, at the early age of 62. The irony was that his American rival at Bretton Woods, Harry Dexter White, was later accused of being a Soviet agent. In August 1948, two days after testifying before the House Un-American Activities Committee, where he denied being a Communist, he died of a heart attack, aged 55. It is time for soberly facing up to reality, to realise that the world has become a far more dangerous place, to acknowledge that the rules of the game have changed. Instead, the markets are ignoring the increase in risks, preferring to believe in fairy dust. Asthis FT story┬Ātells us, ŌĆ£The medium-term future for globalisation seems set: a struggle between Washington and Beijing for pre-eminence, or at least resilience, which continually threatens to override economic efficiency with national security.ŌĆÖŌĆÖ Gordon Brown, in his Finance and Development article, says ŌĆ£a power-based order is replacing a rules-based orderŌĆÖŌĆÖ. This is not a time for fairy tales. Cheers,Manas Chakravarty Here, in case you missed them, are some of the stories and insights we published this week, apart from our technical picks in the equity, commodity and forex markets: Stocks Yes Bank,Fiem Industries,Fedbank Financial,KIMS,Landmark Cars,Concord Biotech,India Energy Exchange,Metro Brands,Petronet LNG,Gala Precision Engineering IPO,Kaynes Technology, Why thischemical stock┬Āwarrants attention, post consolidation? Markets WhatŌĆÖsdragging PSU stocks┬Ādown? Something feels not quite right inthe mid-cap rally WhatŌĆÖs next for theyellow metal? More easing in store for bond yields┬Āin medium term SEBI's neweligibility criteria for the derivative segment┬Āwill reduce market manipulation IPO investors┬Āseek quick returns IndiaŌĆÖs family offices boom: 7x growth in six years Can a Trump presidency bring back a'Reflationary Rally'? Motilal Oswal AMC looks atoilŌĆÖs long-term role┬Āto generate alpha Financial Times We areall capitalists now Index rejects find favour┬Āwith stock market bargain hunters IsJay Powell lucky┬Āor good? Commodities┬Āand the soft landing What we can and canŌĆÖt say aboutwhat we do and donŌĆÖt know Martin Wolf: Lessons from the great inflation EUplan for buying key commodities centrally is over-reach, warn tech groups Companies and sectors Bajaj Housing Finance┬Āneeds more than a successful IPO to become the next HDFC The policy twists that lie in wait forinvestors in sugar mills Indian component makers┬Āstare at risks from slowing global auto sales August Auto sales numbers┬Āindicate mixed trend Home loans the slowest growing segment┬Āfor lenders in FY24 Is ChinaŌĆÖs steel output decline the answer to theIndian steel producersŌĆÖ woes? How power sector revival alteredplans of CESC, Adani Power Gujarat Gas Howprivate lenders┬Āare winning the margin game For IndiaŌĆÖs big banks, small is not beautiful in theNBFC lending market India to seebiggest rise in coal demand┬Āamong major countries in 2024 Banks are left nearly bald┬Āafter IBC haircuts; what's the cure? Rising US sales are boosting profit margins oflarge pharma companies Economy and policy Puzzlingdivergence between private consumption growth and facts┬Āon the ground Decoding Economics:Will ChinaŌĆÖs 'overcapacity' lead to a flood of exports, hurting other countries? World Bank calls upon India tolower tariff barriers to boost exports Monsoon Watch Capex to GDP ratio in April-June 2024highest since September 2012 quarter What GVA data tell us about thestructural change in the Indian economy The government needs totread a fine line on Chinese investments How to plug thetarget-reality gap in manufacturing┬Āmarch? The political will needed toreform GST┬Āis missing ProEconomic Tracker IsoilŌĆÖs long-term role┬Āin the energy mix unavoidable? Semiconductor success┬ĀŌĆö The key is to make the system bug-free Gaps in climate finance framework┬Āmay provide access to new breed of predators Tech & Startups Start-up Street:Does India have true-blue startupreneurs┬Āor only start-up founders? Personal Finance Time diversification: How retail investors can navigate market peaks TheNFO delugeBank-backed AMCstop commission payments to distributors in FY24 Politics J&K Assembly elections: tough challenge for BJP  ","September 07, 2024/ 10:01 IST"
