,URL,title,subtitle,content,article time
16,https://www.moneycontrol.com/news/business/markets/daily-voice-two-wheeler-segment-to-outperform-cv-and-pv-sectors-positive-on-export-oriented-sectors-says-lic-mfs-nikhil-rungta-12816470.html,"Daily Voice: Two-wheeler segment to outperform CV and PV sectors, positive on export-oriented sectors, says LIC MF's Nikhil Rungta",Nikhil Rungta is the Co -Chief Investment Officer â€“ Equity at LIC Mutual Fund Asset Management.Related stories.,"The two-wheeler segment is expected to continue outperforming the commercial and passenger vehicle sectors in the near future too, said Nikhil Rungta, Co -Chief Investment Officer â€“ Equity at LIC Mutual Fund Asset Management in an interview toMoneycontrol. According to him, the two-wheeler segment benefits from favourable demand dynamics and market conditions. As far as top bets are concerned, he remains positive on consumer-related stocks. Additionally, he holds a positive view on export-oriented sectors such as IT and pharmaceuticals, said the seasoned investment professional with 16 years of extensive experience managing diverse investment portfolios. Do you see interesting opportunities in banks & lenders space? The financial sector has relatively underperformed compared to the broader market, yet recent quarterly results indicate strong earnings growth across most segments, except for public sector banks. Given the sector's strong fundamentals and reasonable valuation levels, there is a distinct possibility of outperformance in the next 12 months. However, slowing credit growth, relatively weak deposit growth, potential asset-liability mismatches, and a likely increase in non-performing assets may temper earnings growth for banks and other financial institutions. Consequently, expecting most of the financial sector may perform in line with the market over the next year. Our outlook is positive on asset management, insurance, and wealth management firms. Is the two-wheeler space looking relatively better compared to commercial and passenger vehicles? Yes, the two-wheeler segment has significantly outperformed the commercial and passenger vehicle sectors in recent months, both in terms of fundamental performance and price appreciation. This trend is expected to continue in the near future, as the two-wheeler segment benefits from favourable demand dynamics and market conditions. Your top bets among sectors and why? Despite a mixed performance across consumption-driven sectors in the April-June 2024 quarter results (Source: NSE) â€”with autos and durables showing growth while FMCG and retail underperformedâ€”remaining positive on consumer-related stocks. In contrast, investment-related sectors such as capital goods, construction, real estate, and cement are fundamentally strong but appear to have built-in high expectations in both earnings and valuations. Additionally, holding a positive view on export-oriented sectors such as IT and pharmaceuticals. Should one keep accumulating pharma space? I have a positive outlook on the healthcare sector. However, given the significant differentiation in business models and product lines within the pharma space, a top-down investment approach is challenging. Do you expect SIP inflow to equity market remain unstoppable? While nothing in life or the stock market is unstoppable, there are compelling reasons to believe that SIP inflows into equity mutual funds in India may continue robustly. First, despite market volatility, SIP inflows have been rising steadily since 2016, indicating that Indian households recognize the value of systematic, long-term equity investment as a wealth creation tool. This growing financial literacy is likely to sustain SIP flows in the coming years. Second, while equity allocations have increased, the proportion of equity-linked instruments in Indian household portfolios remains around 15 percent (Source: RBI), just half the global average. As Indian portfolios align more closely with global norms, expect equity allocations to rise, further boosting SIP inflows. Bank deposits still account for more than double the share of equities in household portfolios. With rising financial awareness, anticipate a continued shift toward equities, which may keep SIP flows strong. ","September 07, 2024/ 06:25 IST"
17,https://www.moneycontrol.com/news/business/markets/wall-street-falls-sharply-to-close-its-worst-week-in-nearly-18-months-12816488.html,Wall Street falls sharply to close its worst week in nearly 18 months,"Broadcom, Nvidia and other tech companies drove the market lower amid ongoing concerns that their prices soared too high in the boom around artificial intelligence, and they dragged the Nasdaq composite down by a market-leading 2.6 per cent..Related stories.","Another rout hit Wall Street Friday, with formerly high-flying technology stocks again taking the brunt, after a highly anticipated update on the US job market came in weak enough to add to worries about the economy. The S& P 500 dropped 1.7 per cent to close out its worst week since March 2023. Broadcom, Nvidia and other tech companies drove the market lower amid ongoing concerns that their prices soared too high in the boom around artificial intelligence, and they dragged the Nasdaq composite down by a market-leading 2.6 per cent. The Dow Jones Industrial Average dropped 410 points, or 1 per cent, after erasing a morning gain of 250 points. Sharp swings also hit the bond market, where Treasury yields tumbled, recovered and then fell again after the jobs report showed US employers hired fewer workers in August than economists expected. It was billed as the most important jobs report of the year, and it showed a second straight month where hiring came in below forecasts. It also followed recent reports showing weakness in manufacturing and some other areas in the economy. Such a softening of the job market is actually just what the Federal Reserve and its chair, Jerome Powell, have been trying to get in order to stifle high inflation, ""but only to a certain extent and the data is now testing Chair Powell's stated limits,"" said Scott Wren, senior global market strategist at Wells Fargo Investment Institute. Friday's data raised questions about how much the Federal Reserve will cut its main interest rate by at its meeting later this month. The Fed is about to turn its focus more toward protecting the job market and preventing a recession after keeping the federal funds rate at a two-decade high for more than a year. Cuts to interest rates can boost investment prices, but the worry on Wall Street is that the Fed may be moving too late. If a recession does hit, it would undercut corporate profits and erase the benefits from lower rates. ""All is not well with the labour market,"" said Brian Jacobsen, chief economist at Annex Wealth Management. ""The Fed wanted the labour market to come into better balance, but any balancing act is unstable."" Still, the jobs report did include some encouraging data points. For one, the unemployment rate improved to 4.2 per cent from 4.3 per cent a month earlier. That was better than economists expected. And even if August's hiring was weaker than forecast, it was still better than July's pace. Christopher Waller, a member of the Fed's board of governors, said in a speech after the jobs report's release that ""I believe we should be data dependent, but not overreact to any data point, including the latest data."" ""While the labour market has clearly cooled, based on the evidence I see, I do not believe the economy is in a recession or necessarily headed for one soon,"" he said. While Waller said he thinks a ""series of reductions"" to rates is appropriate given that a slowing job market now looks like the bigger threat for the economy than high inflation, he said the ultimate pace and depth of those cuts is still to be determined. All the uncertainty sent Treasury yields on a wild ride in the bond market as traders tried to handicap the Fed's next moves. The two-year Treasury yield initially fell as low as 3.64 per cent after the release of the jobs report, before quickly climbing back above 3.76 per cent. It then dropped back to 3.66 per cent following Waller's comments, down from 3.74 per cent late Thursday. Wells Fargo Investment Institute's Wren said he was surprised by the size of markets' swings. While data has clearly shown a slowdown in the economy, he's still forecasting growth to continue, ""and it's not the end of the world"". He cautioned investors against panicking and selling their investments in knee-jerk reactions. Despite its dismal week, the S& P 500 remains just 4.6 per cent below its all-time high set in July. It's also still up 13.4 per cent for 2024 so far, which counts as a good year. A big reason for Friday's sharp drops was weakness for some big tech stocks that had been benefiting from the AI boom. Broadcom tumbled 10.4 per cent despite reporting profit and revenue for the latest quarter that were above analysts' forecasts, thanks in part to AI. The chip company said it expects to make $14 billion in revenue this quarter, which was slightly below analysts' expectations of $14.11 billion, according to FactSet. Its stock sank 15.9 per cent for the week. Other chip companies also fell Friday, including a 4.1 per cent drop for Nvidia. After soaring earlier this year as its revenue surged on the AI frenzy, Nvidia's stock has been shaky since mid-July as investors question whether they took it too high. Because of its massive size, Nvidia's stock is one of the most influential on Wall Street, and it fell 13.9 per cent over the week. That's even though Nvidia has continued to top analysts' expectations for growth. On the winning side of Wall Street was US Steel, which rose 4.3 per cent after the CEO of rival Cleveland Cliffs told MSNBC that his company would still be interested in acquiring US Steel if the White House were to block its proposed sale to Japan's Nippon Steel. All told, the S&P 500 fell 94.99 points to 5,408.42. The Dow dropped 410.34 to 40,345.41, and the Nasdaq composite lost 436.83 to 16,690.83. In stock markets abroad, indexes fell across much of Europe and Asia. Trading was halted in Hong Kong because of a typhoon. ","September 07, 2024/ 06:47 IST"
18,https://www.moneycontrol.com/news/business/markets/bonds-rally-as-wallers-remarks-fuel-fed-cut-bets-markets-wrap-12816450.html,Bonds rally as WallerŌĆÖs remarks fuel Fed-cut bets: Markets Wrap,"Treasuries rallied across the curve, with two-year yields down 11 basis points to 3.64%..Related stories.","The worldŌĆÖs biggest bond market climbed as remarks from Federal Reserve Governor Christopher Waller bolstered speculation officials will deploy a super-sized rate cut in September. Treasuries rallied across the curve, with two-year yields down 11 basis points to 3.64%. While policy easing tends to bode well for equities, that isnŌĆÖt usually the case when the Fed has to be aggressive ŌĆö as it might signal a rush to prevent a recession. To make matters worse, the S&P 500 is under heavy pressure from its most-influential group ŌĆö technology. Waller said itŌĆÖs important for the US central bank to begin cutting interest rates this month amid rising risks of further weakening in the labor market. HeŌĆÖs also ŌĆ£open-mindedŌĆØ about the potential for a bigger rate cut and would advocate for one if appropriate. His remarks were made after FridayŌĆÖs jobs data bolstered speculation on a bigger Fed rate cut in September. ŌĆ£Financial markets have turned attention their attention toward how much the Fed will ease and how fast the economy is slowing,ŌĆØ Scott Wren at Wells Fargo Investment Institute. ŌĆ£Expect the near-term volatility to continue.ŌĆØ US 10-year yields declined seven basis points to 3.66%. The S&P 500 fell 1.5%. The Nasdaq 100 sank 2.4%. The Dow Jones Industrial Average slid 0.8%. Some of the main moves in markets. StocksThe S&P 500 fell 1.5% as of 11:25 a.m. New York timeThe Nasdaq 100 fell 2.4%The Dow Jones Industrial Average fell 0.8%The Stoxx Europe 600 fell 1.1%The MSCI World Index fell 1.2% CurrenciesThe Bloomberg Dollar Spot Index was little changedThe euro was little changed at $1.1105The British pound fell 0.2% to $1.3150The Japanese yen rose 1% to 142.06 per dollar CryptocurrenciesBitcoin fell 3.4% to $54,153.68Ether fell 3.3% to $2,289.07 BondsThe yield on 10-year Treasuries declined seven basis points to 3.66%GermanyŌĆÖs 10-year yield declined five basis points to 2.16%BritainŌĆÖs 10-year yield declined three basis points to 3.88% CommoditiesWest Texas Intermediate crude fell 1.6% to $68.05 a barrelSpot gold was little changedThis story was produced with the assistance of Bloomberg Automation. ","September 06, 2024/ 21:38 IST"
19,https://www.moneycontrol.com/news/business/markets/ease-my-trip-yolobus-electric-bus-prototype-12816164.html,"Ease My Trip says work on electric bus prototype underway, aim to ply 2,000 EV buses in two years","Ease My Trip said it sees potential of growth in the EV bus ecosystem, and finds merit in diversification into bus manufacturing.Related stories.","India's second largest travel portal Ease My Trip is in the process of assembling a electric bus prototype, and plans to launch the project by the next financial year. The company had on September 5 announced plans toforay into bus manufacturingÂ with a 2,000 unit facility, which will gradually be scaled up over next two years to 5,000 buses, Manoj Soni, CEO - EV and Mobility, EaseMyTrip told CNBC-TV18 on September 6. Arguing that the business is not unrelated,EaseMyTripsaid that the company has aÂ portalÂ for online bus ticketing called Yolobus, and the new foray into bus manufacturing is related to this business. The unit will be plying EV buses from FY27, catering to in house as well as outside clients, Manoj Soni added. ""We have our tech and R&D teams in place, and we will scale up after an initial investment of Rs 200 crore,"" Soni said. The company declined to talk about how much cash it currently has on books, or how it intends to fund the bus manufacturing project, and said the financial details will be shared at a later stage. However, the initial Rs 200 crore for R&D has been arranged via internal accruals, the CEO said. Ease My Trip already has the board approval to raise Rs 1,000 crore, and the company is considering to do a capital raise in the next couple of months' time, it had said in August. The company sees a potential of growth in the EV bus ecosystem, and finds merit in diversification into bus manufacturing. The CEO confirmed thatÂ Ease My Trip (EMT) will be applying for government support through the PLI scheme for electric vehicles. The bus and train ticketing business currently contributes less than two percent to the revenue, but the non-air travel business has been seeing very strong growth momentum. Trains, buses, and others categories clocked a strong transaction growth of 36.9% YoY in Q1FY25 at 3.1 lakh for EMT. The company has said in the past that they intend to focus on expanding the non-airline business. During the June quarter, the hotels and holiday packages business clocked a gross booking revenue growth of 116% year on year at Rs 210 crore. Since the time of listing in 2013, when 97% of the business was coming from airlines, this number has come down to about 88%, according to Ease My Trip. Over the next couple of years, the company intends to grow the non-air business to 25%, it has said. ","September 06, 2024/ 14:26 IST"
20,https://www.moneycontrol.com/news/business/markets/nazara-tech-buys-48-stake-in-paper-boat-for-rs-300-crore-turns-it-into-fully-owned-unit-12816518.html,"Nazara Tech buys 48% stake in Paper Boat for Rs 300 crore, turns it into fully-owned unit",Nazara said it will also consider merging Paper Boat Apps into the company at the appropriate time..Related stories.,"Nazara Tech has acquired 5,157 equity shares, representing 48.42 percent of Paper Boat Apps Private Limited, from its founding shareholders Anupam Dhanuka and Anshu Dhanuka. The total deal is worth Rs 300 crore, with Rs 225 crore paid as the first installment. With this acquisition, Paper Boat is now a fully owned subsidiary of Nazara Tech. Meanwhile, Kiddopia Inc., a subsidiary of Paper Boat, remains a step-down subsidiary. Nazara Technologieson July 19 announced that it is picking up 48.42 percent stake in Paper Boat Apps that owns the gamified learning app Kiddopia for Rs 300 crore. The deal is part of the company's efforts to scale up its gaming business, which founder Nitish Mittersain believes will be the biggest revenue generator for the firm in the coming years. The gaming company first acquired 50.91 percent stake in Paper Boat Apps for Rs 83.5 crore in 2019. Also Read |ÂZepto picks Goldman Sachs, Morgan Stanley and Axis Capital for its IPO Nazara said it will also consider merging Paper Boat Apps into the company at the appropriate time. This is not Nazara Tech's only big acquisition this year. In May, the company announced it is acquiring a 100 percent stake in mobile gaming subsidiary Nextwave Multimedia by buying the remaining 28.12 percent stake from founder shareholders PR Rajendran, R Kalpana, and PR Jayashree. In the previous session, Nazara Tech shares closed 2.5 percent lower at Rs 920 on the National Stock Exchange (NSE). The stock has gained around 7 percent so far this year, underperforming Nifty's returns of 16 percent. In the past 12 months, the counter has risen just around 4 percent. In comparison, Nifty rose 29 percent during this period. ","September 07, 2024/ 10:16 IST"
21,https://www.moneycontrol.com/news/business/markets/indias-it-revolution-started-with-nses-success-ashish-kumar-chauhan-12816417.html,India's IT revolution started with NSE's success: Ashish Kumar Chauhan,"C.P. Radhakrishnan (L), Governor of Maharashtra inaugurating the statue of the NSE Bull with NSE's MD and CEO Ashish Kumar Chauhan (Image - NSE).Related stories.","The Information Technology revolution in India started with the success of the National Stock Exchange (NSE), said Ashish Kumar Chauhan, MD and CEO of NSE. ŌĆ£From trading under a banyan tree, to trading under a click of the button, to trading on a smartphone, Indian markets have come a long way, he said. Chauhan was speaking at the inauguration of the NSE Bull statue in Mumbai on September 6. The NSE Bull shows a relationship of ŌĆ£bazaarŌĆØ and ŌĆ£samajŌĆØ, where the bull is the symbol of capital markets and the people around it showcases the samaj (society), said Chauhan. Thirty years ago, stock markets were not accessible to the ŌĆśSamajŌĆÖ, and with the automated screen-based trading, markets reached all the corners of the country, he said. Throwing some light on the statistics, Chauhan said that NSE has 10 crore unique investors registered with the exchange, with 19 crore trading accounts covering 99.84 percent pincodes in the country. He added that today, only 30 pincodes in India do not have registered investors. Since 1994, the market capitalisation of NSE-listed companies has increased 121 times to $5.5 trillion. He also added that NSE is the largest exchange today in terms of number of orders and number of trades. ŌĆ£Despite a few hiccups, NSE has more than fulfilled its vision of creating a vibrant and growth oriented stock market ecosystem, channelizing savings of Indian households in the most cost-effective way, transparent, and fair way,ŌĆØ said Chauhan. ","September 06, 2024/ 19:34 IST"
22,https://www.moneycontrol.com/news/business/ipo/twelve-ipos-will-compete-to-raise-over-1-billion-in-a-single-week-12815780.html,Twelve IPOs will compete to raise over $1 billion next week,"Another main board IPO, Western Carriers India, is likely to open soon though the company is yet to announce the details in terms of the issue opening and closing dates..Related stories.","India's primary market is set for a busy next week, with 12 companiesŌĆöfour main board listings and eight SME issuancesŌĆöaiming to raise more than Rs 8,600 crore ($1 billion) as they seek to take advantage of favourable investor sentiment. Among the main board IPOs, the four firms that will vie for investor attention areBajaj Housing Finance, which will raise around Rs 6,560 crore, Tolins Tyres (Rs 230 crore), Kross Ltd (Rs 500 crore) and P N Gadgil Jewellers (Rs 1,100 crore). Another main board IPO, Western Carriers India, is likely to open soon though the company has yet to disclose a specific timeline for the offering. While Bajaj Housing Finance, Tolins Tyres and Kross Ltd will open for subscription on September 9 and close on September 11, P N Gadgil Jeweller IPO will open on September 10 and close on September 12.  Apurva Sheth, Head of Market Perspectives and Research at SAMCO Securities, highlights several factors driving the positive trend in India's primary market. The current market buoyancy is fueled by broad investor participation with retail investors eager to capitalise on attractive listing gains, spurred by the strong performance of the secondary market -- Nifty is up 15.71 percent in the current calendar year till date. Additionally, robust liquidity among both domestic and foreign institutional investors has significantly bolstered the IPO market pipeline. Incidentally, the grey market premiums (GMP) for these firms are also surging. Bajaj Housing Finance GMP is trading at Rs 51 a share, up 73 percent from its upper end price band of Rs 70 a share, Tolins Tyres GMP is trading 12 percent higher while P N Gadgil Jewellers IPO is trading over 37 percent higher. Among SME IPOs, four companies -- Gajanand International, Share Samadhan, Shubhshree Biofuels Energy and Aditya Ultra Steel -- will open for subscription on September 9 and close on September 11. Two firms -- Trafiksol ITS Technologies, SPP Polymer -- will open on September 10 and close on September 13 while another two -- Innomet Advanced Materials and Excellent Wires & Packaging -- will open on September 11 and close on September 13. These firms will raise between Rs 12-45 crore each through their public issues. The recent past has seen IPOs attracting huge subscriptions. Among main board IPOs in August, the average subscription was over 75 times, while the average for 2024 so far stands at 66 times. For SME IPOs, the average subscription in August reached 290 times, with a year-to-date average of over 259 times. The strong subscription across IPOs has been driven by robust participation from retail, institutional, and foreign investors. Data from NSDL shows that while foreign investors have been net sellers in secondary markets, they have consistently invested in primary markets. In August, FIIs invested around Rs 12,872 crore, and so far in CY24, their investments in primary markets have totalled around Rs54,883 crore. Analysts note that most recent IPO offerings are emerging from high-growth, sunrise sectors, thereby attracting investors anticipating strong growth potential. This trend is expected to continue through the rest of 2024 and may extend into 2025, they say. ŌĆ£With growing retail participation and renewed interest from FIIs, driven largely by evolving global macroeconomic conditions, the market environment seems favorable for several upcoming IPOs to finally make their debut on the bourses. The recent success of multiple listings is likely to generate even greater interest in the next wave of IPOs,ŌĆØ says Nirav Karkera, Head of Research at Fisdom. ","September 06, 2024/ 18:02 IST"
