,URL,title,subtitle,content,article time
23,https://www.moneycontrol.com/news/business/markets/va-tech-wabag-stock-surges-8-on-bagging-order-worth-rs-2700-crore-from-saudi-arabia-12815824.html,"VA Tech Wabag stock surges 8% on bagging order worth Rs 2,700 crore from Saudi Arabia","VA Tech Wabag stock: Over the past year, shares of VA Tech Wabag have jumped over 171 percent in trade..Related stories.","VA Tech Wabag shares surged eight percent in early trade on September 6 after bagging an order worth Rs 2,700 crore from theÂ Saudi Water Authority. The order is on a engineering, procurement, construction & commissioning (â€˜EPCCâ€™) basis, for a 300 million litre per day (MLD) mega sea water reverse osmosis desalination plant in Yanbu, Saudi Arabia. At 10.15 am,VA Tech Wabagshares were quoting RsÂ 1,338 on the NSE, higher by 4 percent compared to the previous session's closing price. ""WABAG's impressive track record and technologicallyÂ superior proposal were critical in winning this prestigious order,"" said the firm in a filing with the exchanges. Follow our market blog to catch all the live updates The desalination plant is scheduled to be completed within a 30-month period. ""This plant will be built with the state-of-the-art Desalination technologies, designed for superior energy efficiency and will produce stellar quality of water complying with the environmental regulations of Saudi Arabia,"" added the company. VA Tech Wabag has had a presence in Saudi Arabia,Â building and operating water and waste-water treatment plants, for over 4 decades. Globally since 1995, the firm has constructed over 60 desalination plants in 17 countries, for various municipalities and industries, thereby significantly contributing to the cause of water security. Rohan Mittal, Head â€“ Strategy & Business Growth - GCC said, â€œWe are extremely honoured and proud to secure this mega order from prestigious customer SWA, which will contribute to the ambitious Saudi Vision 2030. This mega order is a testament to our expertise and commitment to delivering high-quality, sustainable water solutions worldwide."" Over the past year, shares of VA Tech Wabag have jumped over 171 percent in trade, as against a 30 percent rise in the NSE Nifty 50 index during the same time period. ","September 06, 2024/ 13:22 IST"
24,https://www.moneycontrol.com/news/business/markets/radhakishan-damani-stock-vst-industries-skyrockets-20-on-ex-bonus-trading-12815812.html,Radhakishan Damani stock VST Industries skyrockets 20% on ex-bonus trading,VST Industries received in-principle approval from BSE and NSE for the issuance and proposed allotment of 15 crore equity shares as bonus shares. The bonus shares will be issued in a 10:1 ratio..Related stories.,"Shares of cigarettes & tobacco products maker VST Industries surged 20 percent to hit the upper circuit as the stock traded ex-bonus. The company had announced the issue of 10 bonus shares for every one share held as of the record date (September 6). This is the first issue of bonus shares that VST Industries has announced. The record date is the specific day a company identifies which shareholders are eligible for benefits from corporate actions such as dividends, bonuses, stock splits, or share buybacks. VST Industriesreceived in-principle approval from BSE and NSE for the issuance and proposed allotment of 15 crore equity shares as bonus shares. Radhakishan Damani will be among the top winners of this bonus issue as the ace investor held 34.7 percent equity stake in the companyÂ as of June 30, 2024.Â Damani had sold a 2.26 percent stake in VST Industries via block deals ahead of the Q1FY25 results and the announcement of the bonus issue of shares in July. Follow our market blog to catch all the live action The cigarette maker reported a 3.5 percent on-year drop in its overall topline to Rs 321.33 crore for the quarter ended June 2024. Its Earnings Before Interest, Tax, Depreciation and Amortisation (EBITDA) fell 30.4 percent YoY to Rs 73.28 crore. VST Industries stock was trading 20 percent higher at Rs 486.15 on the National Stock Exchange (NSE) in the previous session. The stock has gained 33 percent so far this year, outperforming Nifty's returns of 15 percent. In the past 12 months, the counter has risen around 30 percent. In comparison, Nifty rose 28 percent during this period. ","September 06, 2024/ 09:59 IST"
25,https://www.moneycontrol.com/news/business/markets/sbi-cards-shares-surge-5-to-hit-11-month-high-over-goldman-sachs-upgrade-12815910.html,SBI Card shares surge 5% to hit 11-month high over Goldman Sachs upgrade,SBI Cards shares surge 5% to hit 11-month high..Related stories.,"SBI Cards and Payment Services share price hit the 11-month high on Friday after the analysts at the global brokerage Goldman Sachs upgraded its recommendation to 'Buy' from 'Sell' with a hike in share price target. The SBI-promoted card issuance company (SBI Card)Â share surged to a day's high of Rs 808.25 per share on the NSE, up 5.28 percent, which is also its nearly 11-month high. Goldman Sachs has a 'Buy' call on SBI Card share with a revised price target of Rs 913 per share, up from its previous recommendation of Rs 652 apiece.Â The report said the downcycle is nearing its bottom and the company could be nearing its peak of credit costs over the next 2-3 quarters. At the time of publishing, SBI stock was trading at RsÂ 805.10, up 4.87 percent. The company reported a net profit flat at Rs 594 crore in the first quarter of the current fiscal. It reported a net profit of Rs 593 crore in the April-June period of the previous fiscal. The total income during the quarter rose to Rs 4,483 crore against Rs 4,046 crore a year ago, the company said in a regulatory filing. In another development, Goldman Sachs downgraded state-run lender State Bank of India (SBI) to 'Sell' from its earlier rating of 'Neutral' citing multiple headwinds. The global brokerage has also cut its price target on SBI to Rs 742 from an earlier recommendation of Rs 841. ","September 06, 2024/ 13:16 IST"
26,https://www.moneycontrol.com/news/business/premier-energies-stock-soars-18-on-new-order-win-surges-164-above-ipo-price-12815885.html,"Premier Energies stock soars 18% on new order win, surges 164% above IPO price","Premier Energies is the second-largest integrated manufacturer of solar cells and modules in India, with an annual installed capacity of 2 GW for solar cells and 3.36 GW for solar modules.Related stories.","Premier EnergiesÂ  stock was on a stellar streak as well on September 6 following its explosive market debutÂ of 120 percent surge over IPO price on September 3. TheÂ stock is showing no signs of slowing, asÂ it climbed over 18 percent to a new high of Rs 1,188 a day after securing a Rs 215-crore order. Notably, the stock has soared over 30 percent in just two days, marking a blazing start for investors. The order is forÂ the supply, installation, and commissioning with 5-year comprehensive warranty of 8,085 solar water pumping systems across various districts in Uttar Pradesh. The order will be executed by March 2025, the firm stated in a regulatory filing on September 5. Follow our LIVE blog for all the latest market updates This initiative is part of Component B of the PM-KUSUM (Pradhan Mantri Kisan Urja Suraksha evam Utthaan Mahabhiyan) scheme. It is designed to enhance energy security for farmers in India while supporting the country's commitment to increase the share of installed electric power capacity from non-fossil-fuel sources to 40 percent by 2030, in line with its Intended Nationally Determined Contributions (INDCs). Premier Energies is the second-largest integrated manufacturer of solar cells and modules in India, with an annual installed capacity of 2 GW for solar cells and 3.36 GW for solar modules as of March 31, 2024. Read:ÂVodafone Idea drops 13%, Indus Towers falls 6% after Goldman Sachs flags concerns On August 26, a day before the issue opened, Premier Energies raised Rs 846.12 crore through its anchor book. The anchor investors included global marquee names such as Nomura Funds, Blackrock Institutional Trust Company, PGGM World Equity, Government Pension Fund Global, Abu Dhabi Investment Authority, Neuberger Berman Investment Funds, Morgan Stanley, BNP Paribas, Pioneer Investment Fund, Eastspring Investments, Carmignac Portfolio, and Allianz Global Investors Fund. Â Â  ","September 06, 2024/ 12:10 IST"
27,https://www.moneycontrol.com/news/business/markets/delta-corp-shares-rise-nearly-5-amid-likely-relief-at-gst-council-meeting-12815985.html,Delta Corp shares rise nearly 5% amid likely relief at GST Council meeting,Delta Corp shares rise nearly 5% amid likely relief at GST Council meeting.Related stories.,"Casino operatorDelta Corp Ltdshares roseÂ nearly 5 percent on September 6 over likely relief at GST Council meeting on September 9. The Goods and Services Tax (GST) Council is set to meet in Delhi on September 9 to discuss the implementation of the newly introduced Section 11A in the GST Act, 2017, Moneycontrol reported on September 6. The meeting will focus on interpreting the amendment of the section in a bid to grant relief to demand for retrospective tax. It will have implications for the real-money gaming (RMG) â€” online games where players can wager and win real money â€” industry and other sectors, an official said. Delta Corp owns Adda52, which offers online games like poker and rummy. At 11:55 am on September 6, Delta Corp's shares were trading 4.6 percent higher at Rs 137.52 apiece. The real money gaming (RMG) sub-segment constitutes a substantial part of the online gaming ecosystem, comprising 82.8 percent of the market share in FY23, with more than 400 RMG start-ups6. Industry estimates this sub-segment to contribute around Rs 6,500 crore-Rs 6,800 crore as direct tax revenues (comprising TDS and corporate tax), and Rs 75,000-Rs 76,000 crore as indirect tax revenue (GST) to the exchequer during FY24âˆ’28E, said an EY report in December 2023. In its 53rd meeting held in June, the council had recommended the insertion of Section 11A to regularise non-levy or short-levy of GST. Section 11A seeks to provide a legal safeguard against punitive retrospective tax demand and potentially alleviate financial burdens on industries facing outstanding GST dues. The councilâ€™s decision may have major implications for the RMG sector, which has been grappling with significant GST retrospective tax demand pertaining to a period between July 1 , 2017 â€” the day GST was rolled out â€” and March 31, 2023. Last December, the finance ministry had said that 71 show cause notices were issued to online gaming companies for their alleged GST evasion worth over Rs 1.12 lakh crore. ","September 06, 2024/ 12:13 IST"
28,https://www.moneycontrol.com/news/business/markets/sbi-stock-falls-nearly-4-to-3-month-low-over-bearish-call-by-goldman-sachs-12815953.html,SBI stock falls nearly 4% to 3-month low over bearish call by Goldman Sachs,SBI shares dropped over Goldman Sachs report which downgraded its rating..Related stories.,"State Bank of India (SBI) share price fell to a 3-month low on September 6 after global brokerage firm Goldman Sachs downgraded its rating on the stock to 'Sell'. SBI stock fell to the day's low of Rs 787.1 per share on the NSE, down 3.9 percent from its previous close. At the time of publishing, the stock was trading at Rs 790.95, declining 3.4 percent. The sharp fall in the stock came after analysts at Goldman Sachs downgraded it to 'Sell' from 'Neutral'. The brokerage also cut the SBI share price target to Rs 742 from an earlier call of Rs 841 earlier. The revised target price is more than 6 percent lower from yesterday's closing price. Goldman Sachs expects State Bank of India (SBI) to face several challenges as its Return on Assets (RoA) reaches its peak, leading to a possible reduction in valuation. Due to these challenges, the brokerage has lowered its Earnings Per Share (EPS) forecast for SBI by 3-9 percent for the financial years 2025 to 2027. Shares of SBI have delivered 22.86 percent returns on Year-to-date (YTD) rate. SBI stock rose 82.97 percent in the last three years. However, in another development, Goldman Sachs upgraded rating on SBI unit SBI Cards and Payment Services stock to 'Buy' from 'Sell' with a hike in target price, which led to a jump in its share price ","September 06, 2024/ 12:49 IST"
29,https://www.moneycontrol.com/news/business/markets/phoenix-mills-stock-rises-5-as-mall-developer-fixes-record-date-for-bonus-issue-12815958.html,Phoenix Mills stock rises 5% as mall developer fixes record date for bonus issue,"Morgan Stanley in July issued an overweight call on Phoenix Mills with a target price of Rs 3,400 per share..Related stories.","Shares of Phoenix Mills surged by up to 5.6% on September 6 after the company announced the record date for its previously declared bonus issue. The company has set September 21, as the record date for the bonus shares, pending approval from shareholders at the Annual General Meeting (AGM) scheduled for September 13. Phoenix Millsplans to issue one bonus share for each existing share held, marking the first bonus issue in nearly two decades. The last bonus share issuance occurred in December 2005, when the company distributed four free shares for each share held. Currently, Phoenix Millsâ€™ shares have a face value of Rs 2 each. In addition to bonus shares, the retail mall developer and operator has consistently paid annual dividends ranging from Rs 1 to Rs 5 per share, with the most recent dividend of Rs 5 paid in FY24. Follow our market blogÂ  to catch all the live action Phoenix Mills promoters held 47 percent of the company stake as of June 30. Meanwhile, Indian Mutual Funds held a 12.3 percent stake, Foreign Portfolio Investors owned 35.4 percent of the shares. Retail shareholders with authorized share capital of less than Rs 2 lakh held around 2 percent of company's shares. At 11:34 am, Phoenix Mills shares were trading over 1 percent higher at Rs 3,648.75 on the National Stock Exchange (NSE). The stock has gained 62 percent so far this year, outperforming Nifty's returns of 15 percent. In the past 12 months, the counter has zoomed 102 percent, more than doubling investors' capital. In comparison, Nifty rose 28 percent during this period. Morgan Stanley in July issued an overweight call on Phoenix Mills with a target price of Rs 3,400 per share. Despite a slower-than-expected consumption growth in Q1FY25, the company has shown promising signs, the brokerage noted. The sustained performance underscores the company's resilience and potential for continued growth in the retail sector, it added. ","September 06, 2024/ 11:44 IST"
30,https://www.moneycontrol.com/news/business/markets/rama-steel-tubes-surges-over-50-in-three-sessions-whats-triggering-the-upmove-12815961.html,"Rama Steel Tubes surges over 50% in three sessions, what's triggering the upmove?",This partnership will focus on leveraging the expertise of Rama Steel Tubes to provide steel structures along with single-axis trackers to Onix Renewables..Related stories.,"Rama Steel Tubes extended its winning streak for the third consecutive session, surging over 55 percent over three session,Â after the firm announcedÂ aÂ strategic collaboration with Onix Renewable. At 12.15 pm, shares ofÂRama Steel Tubeswere quoting RsÂ 16.37 on the BSE, higher by 18 percent compared to the previous session's closing price. Over 36 crore shares exchanged hands in trade on the bourses, over 500 percent higher than the one-month daily traded average of seven crore shares. Follow our blog to catch all the live updates The trigger that kickstarted this record-breaking rally is Rama Steel Tubes' strategic collaboration with Onix Renewable. ""This partnership will focus on leveraging the expertise of Rama Steel Tubes to provide steel structures along with single-axis trackers, and will also focus on dual-axis trackers to be expanded in the future essential for solar projects undertaken by Onix Renewable,"" said the firm in a filing with the exchanges. Rama Steel Tubes has expanded its expertise and developed specialised steel structures and tracker tubes which will serve as the backbone for Greenfield Solar Projects. This marks the firm's entry into the Green Energy segment. The steel player also added that it is determined to deliver products that ensure the highest standards of reliability, durability, and performance, which are critical to the long-term success of solar greenfield projects. Over the past year, shares of Rama Steel Tubes have gained around 24 percent, as against a 30 percent jump in the Nifty 50 index. ","September 06, 2024/ 12:49 IST"
31,https://www.moneycontrol.com/news/business/markets/dreamfolks-share-price-soars-over-10-on-expansion-into-highway-dining-12816084.html,Dreamfolks share price soars over 10% on expansion into 'highway dining',Dreamfolks shares witnessed sharp uptick with the share price rising to the day's high of Rs 522.15 per share on the NSE.Related stories.,"Dreamfolks Services share price surged over 10 percent on September 6 as the travel and lifestyle experiences company plans to launch the highway dining for travellers. Dreamfolks shares witnessed sharp uptick with the share price rising to day's high of Rs 522.15┬Āapiece on the NSE, rising 10.63 percent from its previous close. The stock had opened with a gain of 4.67 percent in today's session. The uptrend in the stock was witnessed after the share fell for two days consecutively. In the last one month, the share price┬Ārose 11.33 percent on the BSE. Commenting on the launch, Liberatha Kallat, Founder and CMD of DreamFolks, said: "" As we continue to identify opportunities to┬Āenhance the travel experience across multiple touchpoints, expanding our offerings to highways is a natural progression. This new service reflects our vision of creating seamless and elevated travel experiences at every mode of the journey."" The new offering marksDreamFolksŌĆÖ expansion beyond airports and railway stations to provide enhanced convenience for highway travellers. The new service will be available at over 600 outlets along key highways across the country. The company, in an exchange filing, said: ""DreamFolks members can now enjoy specially designed meals at popular restaurants on more than 60 key highway routes emanating from major cities, including Delhi, Mumbai, Bangalore, Hyderabad, Chennai, and Kolkata. The service offers travellers a seamless, hassleŌĆÉfree dining experience while on the road."" The business model of Dreamfolks Services is asset-light and integrates global card players, credit card and debit card issuers with airlines and various airport lounge operators. It also manages airlines' loyalty programmes. Dreamfolks has also bagged contracts from Indian Railways to offer similar services at stations. ","September 06, 2024/ 13:35 IST"
32,https://www.moneycontrol.com/news/business/markets/mid-day-mood-sensex-nifty-slide-over-1-all-13-sectoral-indices-in-red-ahead-of-us-jobs-figure-12815913.html,"Mid-day Mood | Sensex, Nifty slide over 1%; all 13 sectoral indices in red ahead of US jobs data","In the broader market, the BSE Midcap fell a percent and BSE Smallcap index fell 0.6 percent..Related stories.","IT, energy, and banking stocks weighed on Sensex and Nifty 50 on September 6 causing both benchmarks to fall by over aÂ percent around noon. Investors remained cautious ahead of the US jobs data, set to be released later today, which will offer insights into the magnitude of the Federal Reserve's anticipated rate cut in this month's FOMC meeting. At 12 pm, Sensex was down 822 points or 1 percent at 81,378 and Nifty was down 229 points or 0.9 percent at 24,915. About 1,213 shares advanced, 2,083 shares declined, and 65 shares were unchanged. ""The correction was expected due to the market being highly overbought on short-term charts,"" said Mehul Kothari, Assistant Vice-President of Technical Research atÂ Anand Rathi Share and Stock Brokers. Follow our live blog for all the market action Another factor that could be worsening the sell-off is on news that the market regulator will tighten derivative rules to increase entry barriers and make it more expensive to trade as it tries to limit retail investors speculating on risky contracts. Securities and Exchange Board of India (SEBI) will limit the number of options contract expiries to one per exchange a week and nearly triple the minimum trading amount, four sources with direct knowledge of the matter toldMoneycontrol. Also Read |ÂSEBI to tighten F&O rules despite investor pushback, final rules likely this month: Report In the broader market, the BSE Midcap fell a percent and BSE Smallcap index fell 0.6 percent. Meanwhile, the India VIX index, which indicates the volatility of the domestic market, rose nearly 6 percent to 15. Sectoral Trend All 13 major sectoral indices tumbled, with Nifty PSU Bank experiencing the steepest decline, dropping over 2 percent. This was primarily driven by SBI, which plummeted nearly 4 percent and became the hardest-hit stock on the Nifty 50 following Goldman Sachs' downgrade to 'Sell' and a reduced target price of Rs 742 from Rs 841. Nifty Energy, Nifty Infra, and Nifty Bank also saw declines of more than 1 percent each. Fundamental View ""The near-term trend in the market will be influenced by the US jobs data to be published tonight. There is a consensus that the Fed will cut rates in the September meeting but the extent of the cut will be determined by the jobs data,"" said V K Vijayakumar, Chief Investment Strategist at Geojit Financial Services. ""If the August jobs numbers come lower than market expectations and the unemployment rises higher than market expectations, the Fed may even cut by 50 bp. But, this may not be taken positively by the market. The market may even react negatively factoring in serious growth concerns and even a hard landing scenario for the US economy may start weighing on the market."" Vijayakumar said that the Indian economy continues to do well but the only right now is the elevated valuations. Technical View ""Regarding further downside, 24,800 is a critical support level; if breached, more decline could follow. There's only a potential 200 to 300 points downside expected in the short term,"" said Mehul Kothari toldMoneycontrol. He, however, does not anticipate Nifty 50 to fallÂ below 24,800 in today's session and expects a recovery in the benchmarks in the coming week. Also Read |ÂGST Council to discuss key amendment, retro tax relief likely for online gaming companies Key Nifty gainers Bajaj Finance,Â LTIMindtree, HUL,Â Asian Paints,Â JSW Steel Key Nifty losers SBI,Â HCL Tech, Coal India, NTPC, Tata Motors Key Sensex gainers Bajaj Finance, HUL, Asian Paints, JSW Steel, Bajaj Finserv Key Sensex losers SBI, HCL Tech, NTPC, Tata Motors, Infosys Stock moves Vodafone Idea:Shares fell over 13 percent and hit a 52-week low of Rs 9.55 after Goldman maintained its 'Sell' rating on the stock but slightly increased the target price to Rs 2.5 from Rs 2.2, which suggested an 83 percent downside in the stock price. SBI Cards and Payment Services:Â Shares rose nearly 5 percent after the analysts at the global brokerage Goldman Sachs upgraded its recommendation to 'Buy' from 'Sell' with a hike in share price target. ","September 06, 2024/ 13:32 IST"
33,https://www.moneycontrol.com/news/business/markets/gujarat-fluorochemicals-stock-zooms-8-on-heavy-volumes-12816036.html,Gujarat Fluorochemicals stock zooms 8% on heavy volumes,"Despite a below average Q1FY25 results, Gujarat Fluorochemicals stock price has seen an almost 19 percent surge over the past 2 sessions.Related stories.","Shares of Gujarat Fluorochemicals surged over 8 percent on September 6 amid heavy volumes. So far in the day, a total of 16 lakh shares of the company changed hands on BSE and NSE combined, compared to the one-month average trading volume of 2 lakh equity shares At 12:33 pm,Gujarat Fluorochemicalsshares were trading 8.3 percent higher at Rs 3,816.80 on the National Stock Exchange (NSE). After the recent rally, the stock has turned positive on a year-to-date basis. In the past 12 months, the counter has risen 27 percent, in line with Nifty's 27 percent gain during this period. Follow our market blog to catch all the live action For the quarter ended June 30, 2024, Gujarat Fluorochemicals a 2.75 percent year-on-year (YoY) decline in net sales to Rs 1,176 crore. The company's net profit also saw a sharp drop of 46.31 percent YoY, falling to Rs 108 crore. Additionally, EBITDA decreased by 25.24 percent to Rs 271 crore in the quarter under review. Despite a below average Q1FY25 results, Gujarat Fluorochemicals stock price has seen an almost 19 percent surge over the past 2 sessions and now looks overbought in terms of RSI on the daily charts, according to said A R Ramachandran of Tips2trades. ""Next resistance will be at 4,029. Investors are advised to keep booking profits at current price levels as a daily close below the support of 3,680 could lead to a fall till 3,105 in the near term,"" he said. ","September 06, 2024/ 12:44 IST"
